{
  "$schema": "https://json-schema.org/draft/2020-12/schema",
  "$id": "https://espedair.io/schema/template/data-product-catalog",
  "title": "Data Product Catalog Schema",
  "description": "Schema for cataloging platform data products, delivery modes, and transformation tiers.",
  "type": "object",
  "additionalProperties": false,
  "required": [
    "name",
    "platform",
    "products"
  ],
  "properties": {
    "$schema": {
      "type": "string",
      "description": "Optional self-reference to this schema file."
    },
    "name": {
      "type": "string",
      "description": "Logical name for the data product catalog."
    },
    "description": {
      "type": "string",
      "description": "Human-readable summary of catalog scope."
    },
    "source": {
      "type": "string",
      "description": "Source notes, process, or inventory used to derive this catalog."
    },
    "generated_at_utc": {
      "type": "string",
      "format": "date-time",
      "description": "UTC timestamp of catalog generation."
    },
    "platform": {
      "type": "string",
      "description": "Data platform owning or publishing these products."
    },
    "products": {
      "type": "array",
      "minItems": 1,
      "description": "List of available data products or access modes.",
      "items": {
        "type": "object",
        "additionalProperties": false,
        "required": [
          "product_id",
          "product_group",
          "lifecycle_status",
          "owner",
          "steward",
          "product_name",
          "surface",
          "delivery_type",
          "description",
          "consumer_requirement"
        ],
        "properties": {
          "product_id": {
            "type": "string",
            "pattern": "^[a-z0-9][a-z0-9_-]*$",
            "description": "Stable machine-readable product identifier."
          },
          "product_group": {
            "type": "string",
            "enum": [
              "ingress",
              "access",
              "subscription",
              "egress"
            ],
            "description": "Logical grouping of the product within the platform catalog."
          },
          "lifecycle_status": {
            "type": "string",
            "enum": [
              "draft",
              "active",
              "deprecated",
              "retired"
            ],
            "description": "Lifecycle state of the data product."
          },
          "owner": {
            "type": "string",
            "description": "Business or platform owner accountable for the product."
          },
          "steward": {
            "type": "string",
            "description": "Operational or data steward responsible for day-to-day product management."
          },
          "producer_system": {
            "type": "string",
            "description": "Primary system, platform component, or process that produces the data product."
          },
          "primary_consumers": {
            "type": "array",
            "description": "Primary consumer groups, systems, or external recipients for the product.",
            "items": {
              "type": "string"
            }
          },
          "sla": {
            "type": "string",
            "description": "Service level expectation for availability, delivery, or response time."
          },
          "refresh_expectation": {
            "type": "string",
            "description": "Expected refresh cadence or delivery pattern for the product."
          },
          "evidence_anchors": {
            "type": "array",
            "description": "Supporting evidence references for this product, such as notes, code, configs, or runbooks.",
            "items": {
              "type": "object",
              "additionalProperties": false,
              "required": [
                "source",
                "location",
                "detail"
              ],
              "properties": {
                "source": {
                  "type": "string",
                  "description": "Short label for the evidence source."
                },
                "location": {
                  "type": "string",
                  "description": "Path, system, note, or object where the evidence can be found."
                },
                "detail": {
                  "type": "string",
                  "description": "What this evidence proves about the product."
                }
              }
            }
          },
          "product_name": {
            "type": "string",
            "description": "Human-readable product name."
          },
          "surface": {
            "type": "string",
            "description": "Delivery surface, such as Looker Explore, dashboard, or table subscription."
          },
          "delivery_type": {
            "type": "string",
            "enum": [
              "interactive",
              "curated-visual",
              "dataset-subscription",
              "ingestion-pipeline",
              "api",
              "file-delivery",
              "custom"
            ],
            "description": "Primary delivery mechanism for this product."
          },
          "transformation_tier": {
            "type": "string",
            "enum": [
              "bronze",
              "silver",
              "gold"
            ],
            "description": "Optional transformation tier when applicable."
          },
          "description": {
            "type": "string",
            "description": "Business definition of what this product provides."
          },
          "consumer_requirement": {
            "type": "string",
            "description": "Access or subscription requirement for consumers."
          }
        }
      }
    }
  }
}
